item_id,source,source_id,source_type,source_url,title,source_item_url,summary,published_at,discovered_at,stage,score,score_breakdown,platforms,issue_types,intent_flags,business_name,business_site,offer_fit,offer_reason,audit,sales_route,cta_label,cta_destination,subject_draft,message_draft,follow_up_draft,status,contact_method,contact_target,sent_at
c75603b854713000,Search WordPress Support,search-wordpress,forum,search:site:wordpress.org/support/topic schema markup issue,Issue with Schema Markup Not Rendering Properly in Search Results,https://wordpress.org/support/topic/issue-with-schema-markup-not-rendering-properly-in-search-results/,"I've recently added schema markup (using JSON-LD via a plugin) for organization info, local business, and product (for daily gold prices), but Google Search Console shows that structured data is detected but not rendering properly in actual search snippets. Issue Details: Using Rank Math for SEO and schema Site theme is fully schema -compatible",,2026-04-20T18:09:51+00:00,hot,30,"{'schema_hits': ['json-ld', 'schema markup', 'structured data'], 'intent_hits': ['issue', 'search console'], 'platform_hits': [], 'issue_hits': [], 'visibility_hits': ['google search', 'not rendering properly in search results', 'search console', 'search results'], 'negative_hits': [], 'hard_reject_hits': [], 'title_signal_hits': ['issue', 'schema markup'], 'schema_source': True, 'native_action_source': False, 'general_reddit_source': False, 'ecom_platform_source': False}",[],"['google search', 'not rendering properly in search results', 'search console', 'search results']","['issue', 'search console']",,,Done-for-you / service,Treat this as a direct service lead first.,"{'business_site': None, 'schema_present': None, 'notes': ''}",email_contact,Email for direct help,mailto:schemaagent@gmail.com,Direct schema help for: Issue with Schema Markup Not Rendering Properly in Search Results,"I saw your post about 'Issue with Schema Markup Not Rendering Properly in Search Results'. It looks like a schema implementation issue. This looks like a more hands-on case. Best route is to email schemaagent@gmail.com with the page URL and the exact issue. If you want help choosing the fastest route first, email schemaagent@gmail.com.","Quick follow-up on Issue with Schema Markup Not Rendering Properly in Search Results: if you still want direct schema help, send the page URL and issue details to schemaagent@gmail.com.",ready,email,schemaagent@gmail.com,
785dd8fbb173606b,WordPress Support - Schema & Structured Data for WP & AMP,wordpress-schema-support,forum,https://wordpress.org/support/plugin/schema-and-structured-data-for-wp/,Missing field ‘mainEntity’ in FAQ schema,https://wordpress.org/support/topic/missing-field-mainentity-in-faq-schema/,,,2026-04-20T18:09:51+00:00,hot,23,"{'schema_hits': ['faq schema'], 'intent_hits': ['missing'], 'platform_hits': [], 'issue_hits': ['faq schema', 'missing field'], 'visibility_hits': [], 'negative_hits': [], 'hard_reject_hits': [], 'title_signal_hits': ['faq schema', 'missing', 'missing field'], 'schema_source': True, 'native_action_source': True, 'general_reddit_source': False, 'ecom_platform_source': True}",[],"['faq schema', 'missing field']",['missing'],,,AI Visibility Kit,"Lead with a lightweight, lower-friction offer.","{'business_site': None, 'schema_present': None, 'notes': ''}",forum_reply,Get the AI Visibility Kit,https://schemaagent.gumroad.com/l/rfces,AI Visibility Kit could help with: Missing field ‘mainEntity’ in FAQ schema,"I saw your post about 'Missing field ‘mainEntity’ in FAQ schema'. It looks like a faq schema, missing field problem. The simplest next step is the AI Visibility Kit here: https://schemaagent.gumroad.com/l/rfces. It’s better for quick implementation without building everything from scratch. If you want help choosing the fastest route first, email schemaagent@gmail.com.","Quick follow-up on Missing field ‘mainEntity’ in FAQ schema: if you still need a faster schema path, the best fit is here: https://schemaagent.gumroad.com/l/rfces. For questions: schemaagent@gmail.com.",contacted,forum_reply,https://wordpress.org/support/topic/missing-field-mainentity-in-faq-schema/,2026-04-17T12:30:00+00:00
eace5e792a5116d4,Reddit r/TechSEO,reddit-techseo,forum,https://www.reddit.com/r/TechSEO/.rss,Bing Icons,https://www.reddit.com/r/TechSEO/comments/1soiimi/bing_icons/,"Have launched a few websites, and never been able to get my icons to appear on bing/yahoo. They appear fine on Google, DDG (heavily relies on Bing), and all browsers. I have thorough (but not excessive) Metadata/schema/webmanifest, with multiple formats (ico, png, web and jpeg) and sizes (16x16, 32x32, 48x48, 180x180, 192x192, 512x512, 1200x630, etc). I do not link icons in my sitemap. I have bing webmasters set up (with actual search performance) + IndexNow, with verified rich results, and I have full menus in search (whatever it's called when your main page + 5 other pages show in one section). Bing displays one of my logo files below that. Fwiw, most of my projects are SvelteKit+Vite based. I notice that other top result sites on bing also don't have icons. Anybody else experience this? Anyone know a fix? /u/lesbiyond",2026-04-18T00:27:40+00:00,2026-04-20T18:09:51+00:00,hot,22,"{'schema_hits': ['rich result', 'rich results'], 'intent_hits': ['fix'], 'platform_hits': [], 'issue_hits': [], 'visibility_hits': ['bing', 'rich result', 'rich results'], 'negative_hits': ['sitemap'], 'hard_reject_hits': [], 'title_signal_hits': [], 'schema_source': False, 'native_action_source': True, 'general_reddit_source': True, 'ecom_platform_source': False}",[],"['bing', 'rich result', 'rich results']",['fix'],,,Done-for-you / service,Treat this as a direct service lead first.,"{'business_site': None, 'schema_present': None, 'notes': ''}",email_contact,Email for direct help,mailto:schemaagent@gmail.com,Direct schema help for: Bing Icons,"I saw your post about 'Bing Icons'. It looks like a rich result, rich results problem. This looks like a more hands-on case. Best route is to email schemaagent@gmail.com with the page URL and the exact issue. If you want help choosing the fastest route first, email schemaagent@gmail.com.","Quick follow-up on Bing Icons: if you still want direct schema help, send the page URL and issue details to schemaagent@gmail.com.",ready,email,schemaagent@gmail.com,
ed1458b922432690,Search WordPress Support,search-wordpress,forum,search:site:wordpress.org/support/topic faq schema problem,Elementor FAQPage Schema Bug - WordPress.org,https://wordpress.org/support/topic/elementor-faqpage-schema-bug/,"Hi Elementor Support Team, After the latest Elementor update, I've encountered a critical issue with the FAQPage schema markup. Although the content displays correctly on the frontend, the generated JSON-LD is missing the ""text"" field within the acceptedAnswer object, causing errors in Google Search Console. This issue directly affects SEO, as Google is unable to properly validate the FAQ ...",,2026-04-20T18:09:51+00:00,hot,21,"{'schema_hits': ['json-ld', 'schema markup'], 'intent_hits': ['error', 'issue', 'missing', 'search console', 'support'], 'platform_hits': ['wordpress'], 'issue_hits': [], 'visibility_hits': ['google search', 'search console'], 'negative_hits': [], 'hard_reject_hits': [], 'title_signal_hits': [], 'schema_source': True, 'native_action_source': False, 'general_reddit_source': False, 'ecom_platform_source': False}",['wordpress'],"['google search', 'search console']","['error', 'issue', 'missing', 'search console', 'support']",,,Done-for-you / service,Treat this as a direct service lead first.,"{'business_site': None, 'schema_present': None, 'notes': ''}",email_contact,Email for direct help,mailto:schemaagent@gmail.com,Direct schema help for: Elementor FAQPage Schema Bug - WordPress.org,"I saw your post about 'Elementor FAQPage Schema Bug - WordPress.org'. It looks related to wordpress schema setup. This looks like a more hands-on case. Best route is to email schemaagent@gmail.com with the page URL and the exact issue. If you want help choosing the fastest route first, email schemaagent@gmail.com.","Quick follow-up on Elementor FAQPage Schema Bug - WordPress.org: if you still want direct schema help, send the page URL and issue details to schemaagent@gmail.com.",ready,email,schemaagent@gmail.com,
531eee5f23034cb1,Reddit r/bigseo,reddit-bigseo,forum,https://www.reddit.com/r/bigseo/.rss,"I’m seeking some technical guidance regarding a sudden de-indexing issue on my site. Shortly after the recent Google Core Update, a significant number of previously indexed pages were removed from the index.",https://www.reddit.com/r/bigseo/comments/1sqhdb1/im_seeking_some_technical_guidance_regarding_a/,"The Situation: Status: Pages that were previously ranking have been moved to the ""Crawled - currently not indexed"" category in Google Search Console. Manual Actions: No manual actions or security issues are reported in GSC. Technical Check: robots.txt and noindex tags have been verified; there are no blocks or technical directives preventing indexing. Context: The site focuses on Cryptocurrency news and technical blockchain security analysis. /u/digitaljamesoliver",2026-04-20T06:32:51+00:00,2026-04-20T18:09:51+00:00,hot,17,"{'schema_hits': [], 'intent_hits': ['issue', 'search console'], 'platform_hits': [], 'issue_hits': [], 'visibility_hits': ['google search', 'search console'], 'negative_hits': [], 'hard_reject_hits': [], 'title_signal_hits': ['issue'], 'schema_source': False, 'native_action_source': True, 'general_reddit_source': True, 'ecom_platform_source': False}",[],"['google search', 'search console']","['issue', 'search console']",,,Done-for-you / service,Treat this as a direct service lead first.,"{'business_site': None, 'schema_present': None, 'notes': ''}",email_contact,Email for direct help,mailto:schemaagent@gmail.com,Direct schema help for: I’m seeking some technical guidance regarding a sudden de-indexing iss,"I saw your post about 'I’m seeking some technical guidance regarding a sudden de-indexing issue on my site. Shortly after the recent Google Core Update, a significant number of previously indexed pages were removed from the index.'. It looks like a google search, search console problem. This looks like a more hands-on case. Best route is to email schemaagent@gmail.com with the page URL and the exact issue. If you want help choosing the fastest route first, email schemaagent@gmail.com.","Quick follow-up on I’m seeking some technical guidance regarding a sudden de-indexing issue on my site. Shortly after the recent Google Core Update, a significant number of previously indexed pages were removed from the index.: if you still want direct schema help, send the page URL and issue details to schemaagent@gmail.com.",ready,email,schemaagent@gmail.com,
0009f86135aebd37,Search WordPress Support,search-wordpress,forum,search:site:wordpress.org/support/topic faq schema problem,"Bug in Elementor's JSON-LD Schema: Missing ""text"" Field in ...",https://wordpress.org/support/topic/bug-in-elementors-json-ld-schema-missing-text-field-in-acceptedanswer/,"When using the Accordion or FAQ (Frequently Asked Questions) widget in Elementor, the generated JSON-LD code for the FAQPage schema does not include the content of the answers in the ""text"" field within ""acceptedAnswer."" This prevents Google from correctly interpreting the responses, causing them not to appear in rich search results.",,2026-04-20T18:09:51+00:00,hot,16,"{'schema_hits': ['json-ld'], 'intent_hits': ['missing'], 'platform_hits': [], 'issue_hits': [], 'visibility_hits': ['search results'], 'negative_hits': [], 'hard_reject_hits': [], 'title_signal_hits': ['json-ld', 'missing'], 'schema_source': True, 'native_action_source': False, 'general_reddit_source': False, 'ecom_platform_source': False}",[],['search results'],['missing'],,,Done-for-you / service,Treat this as a direct service lead first.,"{'business_site': None, 'schema_present': None, 'notes': ''}",email_contact,Email for direct help,mailto:schemaagent@gmail.com,"AI Visibility Kit could help with: Bug in Elementor's JSON-LD Schema: Missing ""text"" Field in ...","I saw your post about 'Bug in Elementor's JSON-LD Schema: Missing ""text"" Field in ...'. It looks like a schema implementation issue. The simplest next step is the AI Visibility Kit here: https://schemaagent.gumroad.com/l/rfces. It’s better for quick implementation without building everything from scratch. If you want help choosing the fastest route first, email schemaagent@gmail.com.","Quick follow-up on Bug in Elementor's JSON-LD Schema: Missing ""text"" Field in ...: if you still need a faster schema path, the best fit is here: https://schemaagent.gumroad.com/l/rfces. For questions: schemaagent@gmail.com.",ready,forum_reply,https://wordpress.org/support/topic/bug-in-elementors-json-ld-schema-missing-text-field-in-acceptedanswer/,
6905f49a70f930ce,Reddit r/TechSEO,reddit-techseo,forum,https://www.reddit.com/r/TechSEO/.rss,Indexed pages dropped suddenly in GSC – anyone else facing this?,https://www.reddit.com/r/TechSEO/comments/1sqh7v2/indexed_pages_dropped_suddenly_in_gsc_anyone_else/,"Hey guys, I’m seeing a sudden drop in my Google Search Console indexing. Earlier: Indexed: 448 Not Indexed: 181 Now: Indexed: 240 Not Indexed: 416 Almost half my pages got deindexed suddenly. No major changes from my side. Site is active and content is getting published regularly. Most pages are showing under “Crawled – currently not indexed”. Is this normal? Is it due to a Google update or content issue? Anyone faced this and recovered? /u/Realistic_Factor409",2026-04-20T06:24:19+00:00,2026-04-20T18:09:51+00:00,hot,16,"{'schema_hits': [], 'intent_hits': ['issue', 'search console'], 'platform_hits': [], 'issue_hits': [], 'visibility_hits': ['google search', 'search console'], 'negative_hits': [], 'hard_reject_hits': [], 'title_signal_hits': [], 'schema_source': False, 'native_action_source': True, 'general_reddit_source': True, 'ecom_platform_source': False}",[],"['google search', 'search console']","['issue', 'search console']",,,Done-for-you / service,Treat this as a direct service lead first.,"{'business_site': None, 'schema_present': None, 'notes': ''}",email_contact,Email for direct help,mailto:schemaagent@gmail.com,Direct schema help for: Indexed pages dropped suddenly in GSC – anyone else facing this?,"I saw your post about 'Indexed pages dropped suddenly in GSC – anyone else facing this?'. It looks like a google search, search console problem. This looks like a more hands-on case. Best route is to email schemaagent@gmail.com with the page URL and the exact issue. If you want help choosing the fastest route first, email schemaagent@gmail.com.","Quick follow-up on Indexed pages dropped suddenly in GSC – anyone else facing this?: if you still want direct schema help, send the page URL and issue details to schemaagent@gmail.com.",ready,email,schemaagent@gmail.com,
f9d88b5c66a6d90b,Search WordPress Support,search-wordpress,forum,search:site:wordpress.org/support/topic schema markup issue,Structured Data Issue: Price Range in Schema Markup Not Accepted by ...,https://wordpress.org/support/topic/structured-data-issue-price-range-in-schema-markup-not-accepted-by-google/,"Currently, the schema for tickets that has a price range is not supported. However, you're not alone in requesting this—other users have also submitted a feature request, which you can view here: Proper Price Range Representation in Event Rich Data. If this is an important feature for you, we encourage you to upvote the request.",,2026-04-20T18:09:51+00:00,hot,16,"{'schema_hits': ['schema markup', 'structured data'], 'intent_hits': ['issue', 'support'], 'platform_hits': [], 'issue_hits': [], 'visibility_hits': [], 'negative_hits': [], 'hard_reject_hits': [], 'title_signal_hits': ['issue', 'schema markup', 'structured data'], 'schema_source': True, 'native_action_source': False, 'general_reddit_source': False, 'ecom_platform_source': False}",[],[],"['issue', 'support']",,,Done-for-you / service,Treat this as a direct service lead first.,"{'business_site': None, 'schema_present': None, 'notes': ''}",email_contact,Email for direct help,mailto:schemaagent@gmail.com,Direct schema help for: Structured Data Issue: Price Range in Schema Markup Not Accepted by ..,"I saw your post about 'Structured Data Issue: Price Range in Schema Markup Not Accepted by ...'. It looks like a schema implementation issue. This looks like a more hands-on case. Best route is to email schemaagent@gmail.com with the page URL and the exact issue. If you want help choosing the fastest route first, email schemaagent@gmail.com.","Quick follow-up on Structured Data Issue: Price Range in Schema Markup Not Accepted by ...: if you still want direct schema help, send the page URL and issue details to schemaagent@gmail.com.",ready,email,schemaagent@gmail.com,
88c4d3ba240e4597,Reddit r/TechSEO,reddit-techseo,forum,https://www.reddit.com/r/TechSEO/.rss,What does 'normal' Google Search Console stats look like....?,https://www.reddit.com/r/TechSEO/comments/1sm89oo/what_does_normal_google_search_console_stats_look/,"I just recently took a look at my GSC results for the first time in a long time as my associate handles all my SEO work, and these numbers shocked me. Why would there be 47.8k non indexed pages vs. 7.4k indexed? This tells me GSC doesn't think my pages are worth showing, even though I try to make my pages unique. How does your GSC page indexing look like? For context, we're a small cosmetic shop that has thousands of different small products with different shades of the same products, hence lots of pages. /u/Just_girly_things97",2026-04-15T14:49:37+00:00,2026-04-20T18:09:51+00:00,hot,16,"{'schema_hits': [], 'intent_hits': ['search console'], 'platform_hits': [], 'issue_hits': [], 'visibility_hits': ['google search', 'search console'], 'negative_hits': [], 'hard_reject_hits': [], 'title_signal_hits': ['search console'], 'schema_source': False, 'native_action_source': True, 'general_reddit_source': True, 'ecom_platform_source': False}",[],"['google search', 'search console']",['search console'],,,Done-for-you / service,Treat this as a direct service lead first.,"{'business_site': None, 'schema_present': None, 'notes': ''}",email_contact,Email for direct help,mailto:schemaagent@gmail.com,Direct schema help for: What does 'normal' Google Search Console stats look like....?,"I saw your post about 'What does 'normal' Google Search Console stats look like....?'. It looks like a google search, search console problem. This looks like a more hands-on case. Best route is to email schemaagent@gmail.com with the page URL and the exact issue. If you want help choosing the fastest route first, email schemaagent@gmail.com.","Quick follow-up on What does 'normal' Google Search Console stats look like....?: if you still want direct schema help, send the page URL and issue details to schemaagent@gmail.com.",ready,email,schemaagent@gmail.com,
d214198645e6c277,Search WordPress Support,search-wordpress,forum,search:site:wordpress.org/support/topic schema markup issue,LD Json Schema syntax Error causing issues on website,https://wordpress.org/support/topic/ld-json-schema-syntax-error-causing-issues-on-website/,"It appears that another plugin or perhaps your theme might be adding this conflicting schema markup , which is leading to the errors you're seeing. To resolve this, you will need to identify the source of this additional schema and reach out to that particular plugin or theme's support team for further assistance.",,2026-04-20T18:09:51+00:00,hot,15,"{'schema_hits': ['schema markup'], 'intent_hits': ['error', 'issue', 'support'], 'platform_hits': [], 'issue_hits': [], 'visibility_hits': [], 'negative_hits': [], 'hard_reject_hits': [], 'title_signal_hits': ['error', 'issue'], 'schema_source': True, 'native_action_source': False, 'general_reddit_source': False, 'ecom_platform_source': False}",[],[],"['error', 'issue', 'support']",,,Done-for-you / service,Treat this as a direct service lead first.,"{'business_site': None, 'schema_present': None, 'notes': ''}",email_contact,Email for direct help,mailto:schemaagent@gmail.com,Direct schema help for: LD Json Schema syntax Error causing issues on website,"I saw your post about 'LD Json Schema syntax Error causing issues on website'. It looks like a schema implementation issue. This looks like a more hands-on case. Best route is to email schemaagent@gmail.com with the page URL and the exact issue. If you want help choosing the fastest route first, email schemaagent@gmail.com.","Quick follow-up on LD Json Schema syntax Error causing issues on website: if you still want direct schema help, send the page URL and issue details to schemaagent@gmail.com.",ready,email,schemaagent@gmail.com,
a0d9b0d6fb240bd9,Reddit r/shopify,reddit-shopify,forum,https://www.reddit.com/r/shopify/.rss,Regretting starting my store with Shopify,https://www.reddit.com/r/shopify/comments/1sqllx0/regretting_starting_my_store_with_shopify/,"I’ve been dealing with a really frustrating issue beyond the additional subscription costs for apps on the Shopify store. The product feeds from Shopify to Google Merchant Center and Pinterest appear to be completely broken. I’ve already tried multiple fixes including resetting everything, deleting the apps, and reinstalling them but nothing has worked. The core problem is that Shopify is sending incorrect and outdated product data to these platforms. It’s pulling in product listings that were only created as test entries while I was setting up my store, as well as listings that were never published and remained in draft. All of these products have already been deleted from Shopify. Despite that, Google Merchant Center is still trying to sync these non-existent products and, of course, failing. The issue is that I can’t remove them from Google Merchant Center either, because it says they must first be removed from Shopify but they no longer exist there. On top of that, there are two specific products in Google Merchant Center (in English) that are marked as unapproved because the page supposedly “can’t be found.” However, the links are clearly working without any issues. My store is available in three languages, and the English version is active and fully functional, so this error doesn’t make sense. Pinterest is also affected. The product feed ingestion keeps failing and showing errors, so syncing isn’t working there either. I’ve contacted Google Merchant Center support several times, but I only receive generic, unhelpful responses. At this point, I’m stuck the system feels broken, and I have no clear way to fix it. Any advice on how to resolve this would be really appreciated. /u/Confusedmind75",2026-04-20T10:41:29+00:00,2026-04-20T18:09:51+00:00,hot,15,"{'schema_hits': [], 'intent_hits': ['broken', 'error', 'fix', 'issue', 'problem', 'support'], 'platform_hits': ['shopify'], 'issue_hits': [], 'visibility_hits': ['product data', 'product feed'], 'negative_hits': [], 'hard_reject_hits': [], 'title_signal_hits': [], 'schema_source': False, 'native_action_source': True, 'general_reddit_source': False, 'ecom_platform_source': True}",['shopify'],"['product data', 'product feed']","['broken', 'error', 'fix', 'issue', 'problem', 'support']",,,Done-for-you / service,Treat this as a direct service lead first.,"{'business_site': None, 'schema_present': None, 'notes': ''}",email_contact,Email for direct help,mailto:schemaagent@gmail.com,Direct schema help for: Regretting starting my store with Shopify,"I saw your post about 'Regretting starting my store with Shopify'. It looks like a product data, product feed problem on shopify. This looks like a more hands-on case. Best route is to email schemaagent@gmail.com with the page URL and the exact issue. If you want help choosing the fastest route first, email schemaagent@gmail.com.","Quick follow-up on Regretting starting my store with Shopify: if you still want direct schema help, send the page URL and issue details to schemaagent@gmail.com.",ready,email,schemaagent@gmail.com,
