item_id,source,source_id,source_type,source_url,title,source_item_url,summary,published_at,discovered_at,stage,score,score_breakdown,platforms,issue_types,intent_flags,business_name,business_site,offer_fit,offer_reason,audit,sales_route,cta_label,cta_destination,subject_draft,message_draft,follow_up_draft,status,contact_method,contact_target,sent_at
1b23eaf0b585ef21,Reddit r/SEO,reddit-seo,forum,https://www.reddit.com/r/SEO/.rss,Started a project site on March 8 50k+ impressions but only ~40 clicks/day after 40 days. What should I focus on?,https://www.reddit.com/r/SEO/comments/1sq96ph/started_a_project_site_on_march_8_50k_impressions/,"Hey everyone. I launched a B2B SaaS website on March 8, 2026 about 40 days ago), It's a location intelligence platform for the Brazilian market helps entrepreneurs analyze commercial locations before opening a business. Here are my current Google Search Console numbers: Overall stats (March 8 — April 19): Total impressions: ~57,000 Total clicks: ~1,270 Average CTR: 2.2% Average position: 8.6 Daily trend: Week 1 (March 19-23): 13-60 impressions/day, 0-5 clicks Week 2 (March 24-30): 230-1,533 impressions/day, 14-119 clicks Week 3 (March 31 - April 6): 1,185-4,153 impressions/day, 35-81 clicks Week 4+ (April 7-15): 2,800-3,900 impressions/day, 31-57 clicks Indexing: ~50,000 currently indexed Recently fixed sitemap issues (middleware was blocking Googlebot, now resolved) 540 blog articles (mix of programmatic + editorial with real data) What I notice: Impressions grew fast (0 → 4,000/day in 3 weeks) but plateaued Clicks are stuck at ~40/day despite high impressions CTR dropped from ~14% (brand queries only) to ~1.2% as non-brand impressions grew Average position is 8-9 (bottom of page 1) Brand queries (site name) have 75-85% CTR and position 1 Traffic sources context: Had 2 viral TikTok videos (97k and 78k views) that drove signups but didn't affect SEO directly 14 paying customers acquired 100% organically (no ads) Domain is 40 days old My questions: Are ~40 clicks/day from ~3,500 impressions too low for a 40-day-old site? What's a realistic benchmark? Average position is 8-9. How long does it typically take for a new domain to move into positions 3-5? Months? A year? My programmatic pages get impressions but almost zero clicks. Are these worth keeping or are they hurting my SEO as thin content? Should I focus on improving existing pages (better titles, meta descriptions, content depth) or keep creating new editorial content? CTR is 1.2% is this purely a position problem or should I also optimize title tags? For those who've grown a new site from zero what was the turning point that actually started bringing real organic traffic? What should I focus on in months 2-6? Any advice from people who've been through this growth phase would be really appreciated. Happy to share more data if helpful. /u/Big_University_6035",2026-04-19T23:56:33+00:00,2026-04-20T18:09:51+00:00,hot,14,"{'schema_hits': [], 'intent_hits': ['fix', 'issue', 'problem', 'search console'], 'platform_hits': [], 'issue_hits': [], 'visibility_hits': ['google search', 'search console'], 'negative_hits': ['sitemap'], 'hard_reject_hits': [], 'title_signal_hits': [], 'schema_source': False, 'native_action_source': True, 'general_reddit_source': True, 'ecom_platform_source': False}",[],"['google search', 'search console']","['fix', 'issue', 'problem', 'search console']",,,Done-for-you / service,Treat this as a direct service lead first.,"{'business_site': None, 'schema_present': None, 'notes': ''}",email_contact,Email for direct help,mailto:schemaagent@gmail.com,Direct schema help for: Started a project site on March 8 50k+ impressions but only ~40 clicks,"I saw your post about 'Started a project site on March 8 50k+ impressions but only ~40 clicks/day after 40 days. What should I focus on?'. It looks like a google search, search console problem. This looks like a more hands-on case. Best route is to email schemaagent@gmail.com with the page URL and the exact issue. If you want help choosing the fastest route first, email schemaagent@gmail.com.","Quick follow-up on Started a project site on March 8 50k+ impressions but only ~40 clicks/day after 40 days. What should I focus on?: if you still want direct schema help, send the page URL and issue details to schemaagent@gmail.com.",ready,email,schemaagent@gmail.com,
bf46d59f4e7d3349,Reddit r/SEO,reddit-seo,forum,https://www.reddit.com/r/SEO/.rss,Looking for SEO Advice.,https://www.reddit.com/r/SEO/comments/1spom5m/looking_for_seo_advice/,"I need some SEO help. I have set up my website (if I am allowed to, I will post the URL or the name) and I had some PDF files there. So, I went to the Google Search Console and did all I could think of. I remember adding a custom file suggested by the website listed steps. I remember setting up some sort of DNS setting. Here is the deal, though. It is a next.js project and the hosting provider is Vercel. Maybe that has something to do with its poor performance. is there some way I can check on this? Anyway. I went through the process of adding links, but the graphs on the Google Search Console shows almost no progress. Please advise. I can post more stuff, like the emails I have been getting. But I guess this is a good start. /u/Proof-Acanthaceae8",2026-04-19T09:48:38+00:00,2026-04-20T18:09:51+00:00,hot,13,"{'schema_hits': [], 'intent_hits': ['search console'], 'platform_hits': [], 'issue_hits': [], 'visibility_hits': ['google search', 'search console'], 'negative_hits': [], 'hard_reject_hits': [], 'title_signal_hits': [], 'schema_source': False, 'native_action_source': True, 'general_reddit_source': True, 'ecom_platform_source': False}",[],"['google search', 'search console']",['search console'],,,Done-for-you / service,Treat this as a direct service lead first.,"{'business_site': None, 'schema_present': None, 'notes': ''}",email_contact,Email for direct help,mailto:schemaagent@gmail.com,Direct schema help for: Looking for SEO Advice.,"I saw your post about 'Looking for SEO Advice.'. It looks like a google search, search console problem. This looks like a more hands-on case. Best route is to email schemaagent@gmail.com with the page URL and the exact issue. If you want help choosing the fastest route first, email schemaagent@gmail.com.","Quick follow-up on Looking for SEO Advice.: if you still want direct schema help, send the page URL and issue details to schemaagent@gmail.com.",ready,email,schemaagent@gmail.com,
a1331084649d8b7e,Reddit r/bigseo,reddit-bigseo,forum,https://www.reddit.com/r/bigseo/.rss,"Site suddenly got indexed, but still no stable rankings at all",https://www.reddit.com/r/bigseo/comments/1spvxha/site_suddenly_got_indexed_but_still_no_stable/,"Maybe someone here has seen a situation like this before. Quick background: We originally had a different domain that was doing okay at some point, around 1k visits/month. Then it completely dropped out of the index. We tried a lot back then, but nothing really worked. Around 1.5 years ago we decided to move on: - launched a completely new domain - took the old one offline The weird part is that the new domain had basically the same issue in the beginning. For about the first year, indexing was very poor again. We kept working on it here and there, but not in a super aggressive way anymore, because it felt like nothing changed anyway. Then suddenly, around December last year, Google seemed to fully pick it up. From one day to the next, almost the whole site got indexed. Since then: - pages get indexed very fast - updated pages also get reindexed almost instantly - I get some impressions (usually between 0 and 20 a day) - very occasional clicks But the actual problem is: -no stable rankings at all - keywords pop up and disappear again - pages seem to get tested, but nothing really sticks - Ahrefs still shows basically 0 visibility/rankings externally So indexing itself doesn’t seem to be the issue anymore. Google clearly knows the pages, crawls them, and indexes them quickly. But rankings just don’t stabilize. I also had a SEO consultant who in my opinion knew his stuff but didn't find anything and adviced more content etc. Context: - YMYL niche - content is not thin and I would say helpful (but who doesn't think so from their own page :-)) - structure is not the problem, with hubs/clusters/internal linking/breadcrumbs - backlink profile is now also ok in my opinion, at least enough that the site should rank for something It almost feels like some kind of trust/sandbox issue, but at the same time it’s weird because nothing really changes. Google gives little signs of life, tests stuff, reindexes fast, sometimes throws pages in, but nothing becomes stable. Also, whenever a page isn’t indexed, I rework it, and that usually gets it indexed again fast. But still no real traction after that. If anybody had the same problem before, I would be thankful for any advice. /u/DisPater123",2026-04-19T15:23:39+00:00,2026-04-20T18:09:51+00:00,warm,11,"{'schema_hits': [], 'intent_hits': ['issue', 'problem'], 'platform_hits': [], 'issue_hits': [], 'visibility_hits': ['visibility'], 'negative_hits': [], 'hard_reject_hits': [], 'title_signal_hits': [], 'schema_source': False, 'native_action_source': True, 'general_reddit_source': True, 'ecom_platform_source': False}",[],['visibility'],"['issue', 'problem']",,,AI Visibility Kit,Lead with the DIY schema kit as the simplest next step.,"{'business_site': None, 'schema_present': None, 'notes': ''}",forum_reply,Get the AI Visibility Kit,https://schemaagent.gumroad.com/l/rfces,"AI Visibility Kit could help with: Site suddenly got indexed, but still no stable rankings at all","I saw your post about 'Site suddenly got indexed, but still no stable rankings at all'. It looks like a visibility problem. The simplest next step is the AI Visibility Kit here: https://schemaagent.gumroad.com/l/rfces. It’s better for quick implementation without building everything from scratch. If you want help choosing the fastest route first, email schemaagent@gmail.com.","Quick follow-up on Site suddenly got indexed, but still no stable rankings at all: if you still need a faster schema path, the best fit is here: https://schemaagent.gumroad.com/l/rfces. For questions: schemaagent@gmail.com.",ready,forum_reply,https://www.reddit.com/r/bigseo/comments/1spvxha/site_suddenly_got_indexed_but_still_no_stable/,
d2704acb6933f0a9,Reddit r/TechSEO,reddit-techseo,forum,https://www.reddit.com/r/TechSEO/.rss,What actually moved rankings for me: fixing crawl inefficiencies (not backlinks),https://www.reddit.com/r/TechSEO/comments/1snx1my/what_actually_moved_rankings_for_me_fixing_crawl/,"I’ve been working on a few SEO projects recently, and I noticed something interesting: In multiple cases, rankings didn’t improve after publishing content or even building links — until crawl issues were fixed. Here’s what I found and what actually worked: 1. “Crawled – currently not indexed” problem A lot of pages were getting crawled but never indexed. Fix: Improved internal linking to those pages Reduced thin/duplicate content Ensured each page had a clear keyword focus Result: indexing rate improved within a few weeks. 2. Wasted crawl budget on dead pages Googlebot was repeatedly hitting old URLs returning 404. Fix: Converted important ones to 301 (where relevant) Set proper 410 for permanently removed pages Cleaned internal links pointing to dead URLs 3. Weak internal linking structure Important pages were 3–4 clicks deep. Fix: Created contextual internal links from high-authority pages Built simple topic clusters 4. Over-optimized but low-value pages Some pages were keyword-heavy but didn’t actually answer user intent. Fix: Rewrote content to match search intent Removed unnecessary sections and fluff Outcome (after ~6–8 weeks): Better crawl frequency on important pages Faster indexing Rankings improved without aggressive link building Takeaway: Technical SEO is often ignored until something breaks, but in my experience, it’s what unlocks growth — especially in early stages. Curious if others here have seen similar results with crawl optimization? /u/Mediardx007",2026-04-17T10:28:01+00:00,2026-04-20T18:09:51+00:00,warm,11,"{'schema_hits': [], 'intent_hits': ['fix', 'issue', 'problem'], 'platform_hits': [], 'issue_hits': [], 'visibility_hits': ['ignored'], 'negative_hits': ['backlinks'], 'hard_reject_hits': [], 'title_signal_hits': ['fix'], 'schema_source': False, 'native_action_source': True, 'general_reddit_source': True, 'ecom_platform_source': False}",[],['ignored'],"['fix', 'issue', 'problem']",,,AI Generator,Position it as faster schema output for recurring implementation work.,"{'business_site': None, 'schema_present': None, 'notes': ''}",forum_reply,Open the AI Generator,https://schemaagent.gumroad.com/l/wikuuu,AI Generator could help with: What actually moved rankings for me: fixing crawl inefficiencies (not ,"I saw your post about 'What actually moved rankings for me: fixing crawl inefficiencies (not backlinks)'. It looks like a ignored problem. The better fit is the AI Generator here: https://schemaagent.gumroad.com/l/wikuuu. It’s stronger when you need faster repeat schema output instead of filling templates manually. If you want help choosing the fastest route first, email schemaagent@gmail.com.","Quick follow-up on What actually moved rankings for me: fixing crawl inefficiencies (not backlinks): if you still need a faster schema path, the best fit is here: https://schemaagent.gumroad.com/l/wikuuu. For questions: schemaagent@gmail.com.",ready,forum_reply,https://www.reddit.com/r/TechSEO/comments/1snx1my/what_actually_moved_rankings_for_me_fixing_crawl/,
f17bb37979c18785,Reddit r/bigseo,reddit-bigseo,forum,https://www.reddit.com/r/bigseo/.rss,Improved rankings but lost impressions in local SEO — what am I missing?,https://www.reddit.com/r/bigseo/comments/1sqf8mp/improved_rankings_but_lost_impressions_in_local/,"Working on local SEO for a service-based business in a competitive US city and could use some outside perspective. Over the past 3 months: - Consistent Google Business Profile posting (2x/week) - Some content (Medium + “top companies” style posts) - Basic on-page SEO improvements What I’m seeing: - Average position improved (closer to page 1) - CTR improved - But impressions dropped significantly So I’m ranking better, but showing up less. I feel like I’m missing something core about local SEO — especially around map pack visibility. A few questions: - Are citations (chambers, directories, etc.) still a major ranking factor? - Do GBP posts actually influence rankings in any meaningful way? - What kind of backlinks help for local (if at all)?How important are location/service pages nowadays? - Are keyword/location mentions in reviews still impactful? Would really appreciate input from anyone actively working on local campaigns. Trying to figure out what actually moves the needle vs what’s just busy work. /u/InterestingTie77",2026-04-20T04:38:05+00:00,2026-04-20T18:09:51+00:00,warm,10,"{'schema_hits': [], 'intent_hits': ['missing'], 'platform_hits': [], 'issue_hits': [], 'visibility_hits': ['visibility'], 'negative_hits': ['backlinks'], 'hard_reject_hits': [], 'title_signal_hits': ['missing'], 'schema_source': False, 'native_action_source': True, 'general_reddit_source': True, 'ecom_platform_source': False}",[],['visibility'],['missing'],,,AI Visibility Kit,Lead with the DIY schema kit as the simplest next step.,"{'business_site': None, 'schema_present': None, 'notes': ''}",forum_reply,Get the AI Visibility Kit,https://schemaagent.gumroad.com/l/rfces,AI Visibility Kit could help with: Improved rankings but lost impressions in local SEO — what am I missin,"I saw your post about 'Improved rankings but lost impressions in local SEO — what am I missing?'. It looks like a visibility problem. The simplest next step is the AI Visibility Kit here: https://schemaagent.gumroad.com/l/rfces. It’s better for quick implementation without building everything from scratch. If you want help choosing the fastest route first, email schemaagent@gmail.com.","Quick follow-up on Improved rankings but lost impressions in local SEO — what am I missing?: if you still need a faster schema path, the best fit is here: https://schemaagent.gumroad.com/l/rfces. For questions: schemaagent@gmail.com.",ready,forum_reply,https://www.reddit.com/r/bigseo/comments/1sqf8mp/improved_rankings_but_lost_impressions_in_local/,
26c6364e74bc9093,Reddit r/SEO,reddit-seo,forum,https://www.reddit.com/r/SEO/.rss,New South Wales SEO Question,https://www.reddit.com/r/SEO/comments/1spigb4/new_south_wales_seo_question/,"Helping a friend....anyone recommend a credible company to help me get a business appear on page 1 on google searches, in New South Wales, Australia please? Thanks :) /u/Few_Low7383",2026-04-19T04:01:31+00:00,2026-04-20T18:09:51+00:00,watch,7,"{'schema_hits': [], 'intent_hits': [], 'platform_hits': [], 'issue_hits': [], 'visibility_hits': ['google search'], 'negative_hits': [], 'hard_reject_hits': [], 'title_signal_hits': [], 'schema_source': False, 'native_action_source': True, 'general_reddit_source': True, 'ecom_platform_source': False}",[],['google search'],[],,,AI Visibility Kit,Lead with the DIY schema kit as the simplest next step.,"{'business_site': None, 'schema_present': None, 'notes': ''}",forum_reply,Get the AI Visibility Kit,https://schemaagent.gumroad.com/l/rfces,AI Visibility Kit could help with: New South Wales SEO Question,"I saw your post about 'New South Wales SEO Question'. It looks like a google search problem. The simplest next step is the AI Visibility Kit here: https://schemaagent.gumroad.com/l/rfces. It’s better for quick implementation without building everything from scratch. If you want help choosing the fastest route first, email schemaagent@gmail.com.","Quick follow-up on New South Wales SEO Question: if you still need a faster schema path, the best fit is here: https://schemaagent.gumroad.com/l/rfces. For questions: schemaagent@gmail.com.",ready,forum_reply,https://www.reddit.com/r/SEO/comments/1spigb4/new_south_wales_seo_question/,
877ebf4d2c0b126b,Reddit r/TechSEO,reddit-techseo,forum,https://www.reddit.com/r/TechSEO/.rss,OpenSEO Update: I Added Rank Tracking,https://www.reddit.com/r/TechSEO/comments/1sniem8/openseo_update_i_added_rank_tracking/,"First off, thanks for the continued support! It's been really cool seeing people start to build on top of OpenSEO. I was poking around the forks and saw that someone had integrated with Google Ads. Another person from this reddit built their own AI Citation dashboard. Rank Tracking Besides AI Citations / LLM Visibility (up next), Rank Tracking has been the most highly requested feature. In the most recent release, you can now track unlimited domains and keywords in as many countries as you'd like. You can also customize the following values to tune information versus cost: Country Desktop / Mobile / Both Page Depth Cadence: Weekly, Daily, Manual Only $2/month example (cost is dependent on your settings): 50 keywords 1 device (Mobile or Desktop) Search 5 pages deep. Searching ten pages deep costs 8x more than one page. Tracking both devices costs 2x more. Here's another link to the repo: https://github.com/every-app/open-seo Quick Questions How many keywords / domains do you want to track? Anyone know how to handle fluctuations across SERP results from Google testing? Would adding a sample / average option be helpful to smooth that out? Managed OpenSEO If you or your friends want to try OpenSEO, but don't want to self host, the managed version is now ready to go. It's $10/month with included credits, then pay by usage if you need more usage credits. This also gives you access to Backlinks data without the $100/month commitment to DataForSEO. Try it out: https://openseo.so /u/theben9999",2026-04-16T22:20:57+00:00,2026-04-20T18:09:51+00:00,watch,7,"{'schema_hits': [], 'intent_hits': ['support'], 'platform_hits': [], 'issue_hits': [], 'visibility_hits': ['visibility'], 'negative_hits': ['backlinks'], 'hard_reject_hits': [], 'title_signal_hits': [], 'schema_source': False, 'native_action_source': True, 'general_reddit_source': True, 'ecom_platform_source': False}",[],['visibility'],['support'],,https://github.com/every-app/open-seo,AI Visibility Kit,Lead with the DIY schema kit as the simplest next step.,"{'business_site': 'https://github.com/every-app/open-seo', 'schema_present': True, 'notes': 'Business site detected'}",forum_reply,Get the AI Visibility Kit,https://schemaagent.gumroad.com/l/rfces,AI Visibility Kit could help with: OpenSEO Update: I Added Rank Tracking,"I saw your post about 'OpenSEO Update: I Added Rank Tracking'. It looks like a visibility problem. The simplest next step is the AI Visibility Kit here: https://schemaagent.gumroad.com/l/rfces. It’s better for quick implementation without building everything from scratch. If you want help choosing the fastest route first, email schemaagent@gmail.com.","Quick follow-up on OpenSEO Update: I Added Rank Tracking: if you still need a faster schema path, the best fit is here: https://schemaagent.gumroad.com/l/rfces. For questions: schemaagent@gmail.com.",ready,forum_reply,https://www.reddit.com/r/TechSEO/comments/1sniem8/openseo_update_i_added_rank_tracking/,
b5f2d2c3c6a84bb0,Reddit r/SEO,reddit-seo,forum,https://www.reddit.com/r/SEO/.rss,Understanding GSC & co more,https://www.reddit.com/r/SEO/comments/1sqo8tu/understanding_gsc_co_more/,"Hey, beginner SEO consultant here. I'd like to learn more about Google's platforms and what they can do (eg. Search Console). I want to learn to know GSC, I want to understand the impact of the Spam- and Core-updates, ... I want to understand Google a bit more, with a practical understanding of how they are used, not just based on their official statements ... Are there any YouTube videos you can recommend? People I need to follow on LinkedIn? Other things I can do? Thank you very much! /u/Careful-Weakness4685",2026-04-20T12:44:17+00:00,2026-04-20T18:09:51+00:00,watch,7,"{'schema_hits': [], 'intent_hits': ['search console'], 'platform_hits': [], 'issue_hits': [], 'visibility_hits': ['search console'], 'negative_hits': [], 'hard_reject_hits': [], 'title_signal_hits': [], 'schema_source': False, 'native_action_source': True, 'general_reddit_source': True, 'ecom_platform_source': False}",[],['search console'],['search console'],,,AI Visibility Kit,Lead with the DIY schema kit as the simplest next step.,"{'business_site': None, 'schema_present': None, 'notes': ''}",forum_reply,Get the AI Visibility Kit,https://schemaagent.gumroad.com/l/rfces,AI Visibility Kit could help with: Understanding GSC & co more,"I saw your post about 'Understanding GSC & co more'. It looks like a search console problem. The simplest next step is the AI Visibility Kit here: https://schemaagent.gumroad.com/l/rfces. It’s better for quick implementation without building everything from scratch. If you want help choosing the fastest route first, email schemaagent@gmail.com.","Quick follow-up on Understanding GSC & co more: if you still need a faster schema path, the best fit is here: https://schemaagent.gumroad.com/l/rfces. For questions: schemaagent@gmail.com.",ready,forum_reply,https://www.reddit.com/r/SEO/comments/1sqo8tu/understanding_gsc_co_more/,
